{
  "schemaVersion": "1",
  "generatedAt": "2026-09-12T20:37:24.587Z",
  "production": [
    {
      "mindKey": "documentation-truthfulness",
      "name": "Documentation Truthfulness",
      "version": "1.0.0",
      "attribution": "Community archetype; no author or organization endorsement is implied.",
      "category": "Systems & Languages",
      "verified_status": "COMMUNITY_CONTRIBUTED",
      "packagePath": "registry/minds/documentation-truthfulness",
      "sha256": "sha256:92d66e1a28d480cb89b2ef14c1c28683a720e5f0645c73bfee4cba4fd6db1a60",
      "trustAnchor": "0xe7ea2bcb6197db2940ed5f4d3b2fcc49a9dcf93d96513193f78fd18727b90b97",
      "source": "https://raw.githubusercontent.com/lendmind-protocol/LMP/146a2df4c6b222634acbac4419fabce81249431e/README.md",
      "distribution": {
        "status": "PENDING_IPFS_PIN",
        "ipfsCid": null,
        "ociReference": null,
        "mintingWorkflow": "Publish the complete signed package, record the immutable CID and OCI manifest digest, then rerun the production release gate."
      }
    },
    {
      "mindKey": "kernel-inspired-systems",
      "name": "Kernel Inspired Systems",
      "version": "1.0.0",
      "attribution": "Community archetype; no author or organization endorsement is implied.",
      "category": "Systems & Languages",
      "verified_status": "COMMUNITY_CONTRIBUTED",
      "packagePath": "registry/minds/kernel-inspired-systems",
      "sha256": "sha256:c630130dc8b57dd2e93b447d5643e08d156e776468e2208d2cad5fdeb1c87e16",
      "trustAnchor": "0xddecaabb06bfee900fe93560064e9d780b80593d70438b1968e35c396b4ffdb4",
      "source": "https://raw.githubusercontent.com/lendmind-protocol/LMP/146a2df4c6b222634acbac4419fabce81249431e/README.md",
      "distribution": {
        "status": "PENDING_IPFS_PIN",
        "ipfsCid": null,
        "ociReference": null,
        "mintingWorkflow": "Publish the complete signed package, record the immutable CID and OCI manifest digest, then rerun the production release gate."
      }
    },
    {
      "mindKey": "linux-kernel",
      "name": "Linux Kernel",
      "version": "1.0.0",
      "attribution": "Community archetype; no author or organization endorsement is implied.",
      "category": "Systems & Languages",
      "verified_status": "COMMUNITY_CONTRIBUTED",
      "packagePath": "registry/minds/linux-kernel",
      "sha256": "sha256:df7303f00053958d74a51cfcc320ff408f9e343d2c0b8ab9ef5ae889908a5f7a",
      "trustAnchor": "0xc0438581f53986609b26d65e17c60e260e2905b3385b0745af3efd93d6f69c63",
      "source": "https://www.kernel.org/doc/html/latest/process/coding-style.html",
      "distribution": {
        "status": "PENDING_IPFS_PIN",
        "ipfsCid": null,
        "ociReference": null,
        "mintingWorkflow": "Publish the complete signed package, record the immutable CID and OCI manifest digest, then rerun the production release gate."
      }
    },
    {
      "mindKey": "lmp-protocol-core",
      "name": "Lmp Protocol Core",
      "version": "1.0.0",
      "attribution": "Community archetype; no author or organization endorsement is implied.",
      "category": "Systems & Languages",
      "verified_status": "COMMUNITY_CONTRIBUTED",
      "packagePath": "registry/minds/lmp-protocol-core",
      "sha256": "sha256:81c7ed0a275240d5edef79e8b87d9e6624bf12d91aac376147f78261a9785314",
      "trustAnchor": "0xca250e239f28c449fe8e32991daa1ccda0c4a418843442004fe02dcd75070081",
      "source": "https://www.kernel.org/doc/html/latest/process/coding-style.html",
      "distribution": {
        "status": "PENDING_IPFS_PIN",
        "ipfsCid": null,
        "ociReference": null,
        "mintingWorkflow": "Publish the complete signed package, record the immutable CID and OCI manifest digest, then rerun the production release gate."
      }
    },
    {
      "mindKey": "monorepo-and-release-discipline",
      "name": "Monorepo And Release Discipline",
      "version": "1.0.0",
      "attribution": "Community archetype; no author or organization endorsement is implied.",
      "category": "Systems & Languages",
      "verified_status": "COMMUNITY_CONTRIBUTED",
      "packagePath": "registry/minds/monorepo-and-release-discipline",
      "sha256": "sha256:136cab40d8334b687341ad33be521b278740fab6e6c47a8cd70405ac19cd47b2",
      "trustAnchor": "0x0e2161b82cfb389e36f029cc171a541156f5d2f8eaa2cd8d1aa2cd8591f973b3",
      "source": "https://raw.githubusercontent.com/lendmind-protocol/LMP/146a2df4c6b222634acbac4419fabce81249431e/README.md",
      "distribution": {
        "status": "PENDING_IPFS_PIN",
        "ipfsCid": null,
        "ociReference": null,
        "mintingWorkflow": "Publish the complete signed package, record the immutable CID and OCI manifest digest, then rerun the production release gate."
      }
    },
    {
      "mindKey": "node-onboarding-safety",
      "name": "Node Onboarding Safety",
      "version": "1.0.0",
      "attribution": "Community archetype; no author or organization endorsement is implied.",
      "category": "Systems & Languages",
      "verified_status": "COMMUNITY_CONTRIBUTED",
      "packagePath": "registry/minds/node-onboarding-safety",
      "sha256": "sha256:f8470e6e9057e429e8bf52e5292e4005a72666bed69c143c2f711a4cfd6e40ec",
      "trustAnchor": "0xed0f4dbfc8786d6d366b044a691b1c3b2750091eb4acf249e32e589cf510aea1",
      "source": "https://raw.githubusercontent.com/lendmind-protocol/LMP/146a2df4c6b222634acbac4419fabce81249431e/README.md",
      "distribution": {
        "status": "PENDING_IPFS_PIN",
        "ipfsCid": null,
        "ociReference": null,
        "mintingWorkflow": "Publish the complete signed package, record the immutable CID and OCI manifest digest, then rerun the production release gate."
      }
    },
    {
      "mindKey": "python-orchestration-safety",
      "name": "Python Orchestration Safety",
      "version": "1.0.0",
      "attribution": "Community archetype; no author or organization endorsement is implied.",
      "category": "Systems & Languages",
      "verified_status": "COMMUNITY_CONTRIBUTED",
      "packagePath": "registry/minds/python-orchestration-safety",
      "sha256": "sha256:a937334ba02139b3bfc7ee7719dbd6582404f723c7e61ffdfd2f5f41b32faffb",
      "trustAnchor": "0x7983b5d32f8c76761b01c70a969a69701e68d75eed84fd11b226fd0cfa4e91b3",
      "source": "https://raw.githubusercontent.com/lendmind-protocol/LMP/146a2df4c6b222634acbac4419fabce81249431e/README.md",
      "distribution": {
        "status": "PENDING_IPFS_PIN",
        "ipfsCid": null,
        "ociReference": null,
        "mintingWorkflow": "Publish the complete signed package, record the immutable CID and OCI manifest digest, then rerun the production release gate."
      }
    },
    {
      "mindKey": "rust-defensive-systems",
      "name": "Rust Defensive Systems",
      "version": "1.0.0",
      "attribution": "Community archetype; no author or organization endorsement is implied.",
      "category": "Systems & Languages",
      "verified_status": "COMMUNITY_CONTRIBUTED",
      "packagePath": "registry/minds/rust-defensive-systems",
      "sha256": "sha256:830ec3f3983347d1b1268102365c4bff689cd2822e0826f6c28f1ac01d900a06",
      "trustAnchor": "0xc90ed6e56eb804e236f08d4fd59f0c1294748c03d2a1fdc9d427ed42408ab154",
      "source": "https://raw.githubusercontent.com/lendmind-protocol/LMP/146a2df4c6b222634acbac4419fabce81249431e/README.md",
      "distribution": {
        "status": "PENDING_IPFS_PIN",
        "ipfsCid": null,
        "ociReference": null,
        "mintingWorkflow": "Publish the complete signed package, record the immutable CID and OCI manifest digest, then rerun the production release gate."
      }
    },
    {
      "mindKey": "security-and-trust-boundaries",
      "name": "Security And Trust Boundaries",
      "version": "1.0.0",
      "attribution": "Community archetype; no author or organization endorsement is implied.",
      "category": "Systems & Languages",
      "verified_status": "COMMUNITY_CONTRIBUTED",
      "packagePath": "registry/minds/security-and-trust-boundaries",
      "sha256": "sha256:cd97085cf641a77f67d2d6e8344813cce18d72de1b45189c751f126e6fe4324e",
      "trustAnchor": "0xe0e070e8048174a9530adfff0b6b138999220768140c2ca982df9e7db8454b50",
      "source": "https://raw.githubusercontent.com/lendmind-protocol/LMP/146a2df4c6b222634acbac4419fabce81249431e/README.md",
      "distribution": {
        "status": "PENDING_IPFS_PIN",
        "ipfsCid": null,
        "ociReference": null,
        "mintingWorkflow": "Publish the complete signed package, record the immutable CID and OCI manifest digest, then rerun the production release gate."
      }
    },
    {
      "mindKey": "supabase-core",
      "name": "Supabase Core",
      "version": "1.0.0",
      "attribution": "Community archetype; no author or organization endorsement is implied.",
      "category": "Agentic Frameworks & Context Engineering",
      "verified_status": "COMMUNITY_CONTRIBUTED",
      "packagePath": "registry/minds/supabase-core",
      "sha256": "sha256:e2f484688b0015d3541ab6ab1045e32834baad1249bdfcd7858bbaf4a192e58d",
      "trustAnchor": "0xc97f43158dd7c6dc4e6d18c4111a78a18d49f3ed3d479adb47044983256949ce",
      "source": "https://supabase.com/docs/guides/database/postgres/row-level-security",
      "distribution": {
        "status": "PENDING_IPFS_PIN",
        "ipfsCid": null,
        "ociReference": null,
        "mintingWorkflow": "Publish the complete signed package, record the immutable CID and OCI manifest digest, then rerun the production release gate."
      }
    },
    {
      "mindKey": "tj-ponytail",
      "name": "Tj Ponytail",
      "version": "1.0.0",
      "attribution": "Community archetype; no author or organization endorsement is implied.",
      "category": "Agentic Frameworks & Context Engineering",
      "verified_status": "COMMUNITY_CONTRIBUTED",
      "packagePath": "registry/minds/tj-ponytail",